{
  "schema": "sns.evidence-event.v1",
  "evidence_id": "EVID-20260726T145840000000Z-plasmonic-rtpv-c3d4e5f60718293a4b5c",
  "claim_cluster_id": "CLM-20260726T145840000000Z-plasmonic-rtpv-d4e5f60718293a4b5c6d",
  "claim": "NASA selected a Phase I concept combining thermophotovoltaic conversion with plasmonic spectral control for long-duration non-solar space power.",
  "source_uri": "https://www.nasa.gov/directorates/stmd/niac/niac-studies/plasmon-enhanced-radioisotope-thermophotovoltaic-prtpv-power-generation-for-interstellar-missions/",
  "source_kind": "official_statement",
  "source_fingerprint": "sha256:6b8c4d2e0f193a5b7c9d1e3f5a7b9c0d6b8c4d2e0f193a5b7c9d1e3f5a7b9c0d",
  "observed_at": "2026-07-26T14:58:40Z",
  "independence": "independent",
  "polarity": "context_only",
  "confidence": 0.48,
  "provenance": {
    "source_title": "Plasmon-Enhanced Radioisotope Thermophotovoltaic Power Generation for Interstellar Missions",
    "publication_date": "2026-07-21",
    "primary_or_secondary": "primary_program_statement",
    "environment": "deep-space-concept",
    "demonstrated_scale": "Phase-I-concept",
    "subsystems": ["STOR", "META", "CTRL", "MAT"],
    "mission_relevance": ["shadow-survival", "thermal-conversion", "spectral-control"],
    "evidence_tier": "C",
    "directness": 0.36,
    "novelty": 0.72,
    "limitations": [
      "NIAC Phase I concept rather than demonstrated hardware.",
      "Radioisotope architecture does not map directly to a disposable 10 mm SNS seed.",
      "Target performance values are proposal goals, not measured results."
    ],
    "fact_summary": "NASA describes a NIAC Phase I concept targeting more than 40 percent thermal-to-electric efficiency and 17 W/kg by combining high-index thermal coupling with plasmonic spectral matching.",
    "inference_summary": "Photonic spectral control remains relevant to larger host or relay power architectures, but this does not close rechargeable seed storage or packaged shadow-survival constraints.",
    "speculation_summary": "A heterogeneous SNS family may eventually use non-solar survival power on hosts while keeping scout seeds solar-dependent.",
    "created_by_run_id": "RUN-20260726T145840000000Z-weekly-evidence-synthesis-f0e1d2c3b4a596877869"
  },
  "artifacts": ["calendar/roundups/2026-07-26.md"]
}