{
  "schema": "sns.evidence-event.v1",
  "evidence_id": "EVID-20260719T145804000000Z-leo-sbsp-allocation-153c18549ea18a09e360",
  "claim_cluster_id": "CLM-20260719T145804000000Z-leo-sbsp-cluster-34d3b224b31a4f092f68",
  "claim": "A constellation-level LEO SBSP simulation left two of eight receivers unserved under a greedy allocation policy.",
  "source_uri": "https://arxiv.org/abs/2606.18416",
  "source_kind": "primary_paper",
  "source_fingerprint": "sha256:b63b437304d70507d0a1b9541003733d98bb69a773b693d10c8f3d34f33b088e",
  "observed_at": "2026-07-19T14:58:04Z",
  "independence": "independent",
  "polarity": "supports",
  "confidence": 0.72,
  "provenance": {
    "source_title": "Constellation-Level Power Allocation for LEO Space-Based Solar Power",
    "publication_date": "2026-06-16",
    "event_date": "2026-06-16",
    "primary_or_secondary": "primary",
    "environment": "simulation-LEO",
    "demonstrated_scale": "system",
    "subsystems": ["SBSP", "CTRL", "SWARM", "STOR"],
    "mission_relevance": ["power-allocation", "eclipse-management", "receiver-service"],
    "evidence_tier": "B",
    "directness": 0.72,
    "novelty": 0.70,
    "limitations": [
      "Simulation preprint rather than flight demonstration.",
      "Reported outcomes depend on declared constellation, propagation, coupling, atmospheric, battery, and greedy-policy assumptions.",
      "Earth-facing microwave delivery is not identical to SNS optical relay operation."
    ],
    "fact_summary": "A 20-satellite LEO SBSP simulation modeled eclipse, microwave coupling, atmosphere, and batteries; two of eight ground stations received no service under the greedy allocation policy.",
    "inference_summary": "SNS power-network evaluation must report starvation and service distribution, not only aggregate or peak delivered power.",
    "speculation_summary": "Fairness-aware allocation may sacrifice peak throughput while making a heterogeneous relay network operationally more credible.",
    "created_by_run_id": "RUN-20260719T145804000000Z-weekly-evidence-synthesis-f8e3ccd335c1798175a9"
  },
  "artifacts": ["calendar/roundups/2026-07-19.md"]
}
