{
  "schema": "sns.evidence-event.v1",
  "evidence_id": "EVID-20260823T145740000000Z-calendar-deterministic-staging-fa990303381b4f174420",
  "claim_cluster_id": "CLM-20260823T145740000000Z-calendar-pipeline-fa990303381b4f174420",
  "claim": "QST-CALENDAR-0001 now has an accepted proposal-only staging boundary plus deterministic serialization and output support, validated by hosted automation tests and repository semantic validation without granting governance authority to the tool.",
  "source_uri": "https://github.com/xxx3r/SNS-S-S/commit/2e36b7cc586770bef991f8ff0f3b2c96bda9c931",
  "source_kind": "experiment",
  "source_fingerprint": "sha256:9aefba6d9670aecd00f533846ef07dab497df5b39a7f8e21b283448a5f1266c3",
  "observed_at": "2026-08-23T14:57:40Z",
  "independence": "independent",
  "polarity": "supports",
  "confidence": 0.94,
  "provenance": {
    "source_title": "Serialize staged roundups deterministically",
    "publication_date": "2026-08-11",
    "primary_or_secondary": "primary_repository_artifact",
    "environment": "SNS automation transaction layer",
    "demonstrated_scale": "proposal-only weekly staging and serialization boundary",
    "subsystems": ["CALENDAR", "AUTOMATION"],
    "evidence_tier": "A-repository",
    "directness": 0.98,
    "novelty": 0.70,
    "limitations": [
      "No real weekly evidence was processed by either Daily slice.",
      "The staging implementation does not grant authority to enact belief or quest proposals."
    ],
    "fact_summary": "Accepted August 10 and 11 Daily slices added proposal-only staging and deterministic serialization/output support with hosted checks green.",
    "inference_summary": "The weekly proposal pipeline has a stronger deterministic pre-publication boundary.",
    "speculation_summary": "Further pipeline work should be driven by observed failure modes rather than infrastructure expansion for its own sake.",
    "created_by_run_id": "RUN-20260823T145740000000Z-weekly-evidence-synthesis-6375ac8eb1cac4d6670b"
  },
  "artifacts": ["calendar/roundups/2026-08-23.md"]
}